{
  "id": "the-strongest-princess",
  "title": "The Strongest Princess",
  "type": "game",
  "url": "https://unotchi.com/the_strongest_princess/",
  "repository": "https://github.com/sanpeita/the_strongest_princess",
  "thumbnail": "assets/exhibits/placeholder.svg",
  "description": "最強の姫を操作し、ダンジョンを爆砕しながら進む、ブラウザで遊べる2Dスクロールアクションゲームです。",
  "shortDescription": "最強の姫がダンジョンを爆砕して進む2Dアクション。",
  "category": "casual-game",
  "tags": ["AI Studio", "オフライン", "2Dアクション"],
  "updatedAt": "2026-08-25",
  "featured": false,
  "order": 40,
  "status": "published",
  "web": { "visible": true },
  "gallery3d": { "visible": true, "room": "games", "order": 4 }
}
