{
  "id": "island-survival-craft-defense",
  "title": "Island Survival Craft & Defense",
  "type": "game",
  "url": "https://unotchi.com/Island-Survival-Craft-Defense/",
  "repository": "https://github.com/sanpeita/Island-Survival-Craft-Defense",
  "thumbnail": "assets/exhibits/placeholder.svg",
  "description": "島で資源を集め、クラフトと拠点防衛を進める、ブラウザで遊べる3Dサバイバルゲームです。",
  "shortDescription": "島で資源を集め、クラフトと拠点防衛を進める、ブラウザで遊べる3Dサバイバルゲームです。",
  "category": "survival-game",
  "tags": [
    "3D",
    "サバイバル",
    "クラフト",
    "ブラウザゲーム"
  ],
  "createdAt": "2026-08-25",
  "updatedAt": "2026-08-25",
  "featured": false,
  "order": 15,
  "status": "published",
  "web": {
    "visible": true
  },
  "gallery3d": {
    "visible": true,
    "room": "games",
    "order": 7
  }
}
