{
  "id": "hole-io",
  "title": "Hole-IO",
  "type": "game",
  "url": "https://unotchi.com/Hole-IO-Casual-Game/",
  "repository": "https://github.com/sanpeita/Hole-IO-Casual-Game",
  "thumbnail": "assets/exhibits/placeholder.svg",
  "description": "街のオブジェクトを吸い込みながら穴を大きくしていく、縦画面で遊べるカジュアルゲームです。",
  "shortDescription": "街を吸い込み、穴を育てる縦画面カジュアルゲーム。",
  "category": "casual-game",
  "tags": ["AI Studio", "オフライン", "カジュアルゲーム"],
  "updatedAt": "2026-08-25",
  "featured": false,
  "order": 10,
  "status": "published",
  "web": { "visible": true },
  "gallery3d": { "visible": true, "room": "games", "order": 1 }
}
