{
  "id": "dodge-and-gather",
  "title": "dodge & gather",
  "type": "game",
  "url": "https://unotchi.com/dodge-and-gather/",
  "repository": "https://github.com/sanpeita/dodge-and-gather",
  "thumbnail": "assets/exhibits/placeholder.svg",
  "description": "ネオンの障害物を避けながらアイテムを集める、ブラウザで遊べるカジュアルアクションゲームです。",
  "shortDescription": "ネオンの障害物を避けて集めるカジュアルアクション。",
  "category": "casual-game",
  "tags": ["AI Studio", "オフライン", "カジュアルゲーム"],
  "updatedAt": "2026-08-25",
  "featured": false,
  "order": 20,
  "status": "published",
  "web": { "visible": true },
  "gallery3d": { "visible": true, "room": "games", "order": 2 }
}
