{
  "id": "offline-flap",
  "title": "OfflineFlap",
  "type": "game",
  "url": "https://unotchi.com/OfflineFlap/",
  "repository": "https://github.com/sanpeita/OfflineFlap",
  "thumbnail": "assets/exhibits/placeholder.svg",
  "description": "タイミングよく羽ばたいて障害物を抜ける、ブラウザで遊べるフラップアクションゲームです。",
  "shortDescription": "タイミングよく障害物を抜けるフラップアクション。",
  "category": "casual-game",
  "tags": ["AI Studio", "オフライン", "カジュアルゲーム"],
  "updatedAt": "2026-08-25",
  "featured": false,
  "order": 30,
  "status": "published",
  "web": { "visible": true },
  "gallery3d": { "visible": true, "room": "games", "order": 3 }
}
